{"name":"excel-report-checker","version":"1.0.0","source":{"type":"clean-room-rebuild","original_name":"excel-data-comparison","original_version":"0.0.3"},"platforms":["Codex","Claude Code","OpenClaw","generic-agent"],"permissions":{"files":["explicitly provided Excel files","explicit output path"],"network":[],"commands":[]},"safety_defaults":{"preserve_sources":true,"uncertain_matches_require_review":true,"network_disabled":true},"review":{"status":"passed","risk":"low","reviewed_at":"2026-06-18"}}
