{"name":"complaint-case-organizer","version":"1.0.0","source":{"type":"clean-room-rebuild","original_name":"complaint-workflow","original_version":"1.0.2","original_sha256":"ed21e53d96dea4cb90d936fd4287956550adc9ef2bbd960cc4bcfe5365c7325b"},"platforms":["Codex","Claude Code","OpenClaw","generic-agent"],"permissions":{"files":["explicitly provided complaint records","explicit output path"],"network":[],"commands":[]},"safety_defaults":{"data_minimization":true,"external_actions_disabled":true,"human_review_required":true},"review":{"status":"passed","risk":"low","reviewed_at":"2026-06-18"}}
