{"name":"shift-schedule-planner","version":"1.0.0","source":{"type":"clean-room-rebuild","original_name":"mid-shift-scheduler","original_version":"1.0.0"},"platforms":["Codex","Claude Code","OpenClaw","generic-agent"],"permissions":{"files":["explicitly provided roster files","explicit output path"],"network":[],"commands":[]},"safety_defaults":{"human_approval_required":true,"no_sensitive_inference":true,"network_disabled":true},"review":{"status":"passed","risk":"low","reviewed_at":"2026-06-18"}}
