{"name":"team-blocker-tracker","version":"1.0.0","source":{"type":"clean-room-rebuild","original_name":"checkpoint-arbiter","original_version":"1.0.0","original_sha256":"6278dcf0b19faa284611100c363cf03ed444199238785289cd9097ce825c9d4b"},"platforms":["Codex","Claude Code","OpenClaw","generic-cli"],"permissions":{"files":["explicit SQLite database","explicit CSV export"],"network":[],"commands":["python3"]},"safety_defaults":{"notifications_disabled":true,"ai_disabled":true,"local_only":true,"deduplication":true},"review":{"status":"passed","risk":"low","reviewed_at":"2026-06-18"}}
