{"name":"daily-report-organizer","version":"1.0.0","source":{"type":"clean-room-rebuild","original_name":"daily-work-report-bot","original_version":"1.0.0"},"platforms":["Codex","Claude Code","OpenClaw","generic-agent"],"permissions":{"files":["explicitly provided notes","explicit output path"],"network":[],"commands":[]},"safety_defaults":{"fact_preservation":true,"no_employee_scoring":true,"network_disabled":true},"review":{"status":"passed","risk":"low","reviewed_at":"2026-06-18"}}
