{"name":"faq-content-optimizer","version":"1.0.0","source":{"type":"clean-room-rebuild","original_name":"faq-optimizer-bot","original_version":"1.2.1","original_sha256":"b8438619a82526d7f014b1eb6c1de1f7a7febff4279ff1cb8bd936cd0d54020e"},"platforms":["Codex","Claude Code","OpenClaw","generic-agent"],"permissions":{"files":["explicitly provided FAQ content","explicit output path"],"network":[],"commands":[]},"safety_defaults":{"preserve_policy_meaning":true,"publishing_disabled":true,"human_review_required":true},"review":{"status":"passed","risk":"low","reviewed_at":"2026-06-18"}}
