{"name":"safe-api-tester","version":"1.0.0","source":{"type":"clean-room-rebuild","original_name":"WebAPISkill","original_version":"1.2.0","original_sha256":"1877f7ea8de07d30927f09c9b74157d2b68f6dfd3aaed3bde934f04e7ecc0cff"},"platforms":["Codex","Claude Code","OpenClaw","generic-cli"],"permissions":{"files":["input CSV","local HTML report"],"network":["localhost and explicit allowlist"],"commands":["python3"]},"safety_defaults":{"read_methods_only":true,"host_allowlist":true,"report_delivery":"local-only","redaction":true},"review":{"status":"restricted","risk":"medium","reviewed_at":"2026-06-18","restriction":"write methods require explicit double confirmation"}}
